{
  "schema_version": "1.1.0",
  "id": "mere-nature-law",
  "title": "Mère nature",
  "artist": "LAW'",
  "language": "fr",
  "duration": 225.272721,
  "audio": {
    "instrumental": "instrumental.wav",
    "vocals": "vocals.wav",
    "loudness_lufs": null
  },
  "video": null,
  "cover": null,
  "singers": [
    {
      "id": "s1",
      "name": null,
      "color": null
    }
  ],
  "lines": [
    {
      "id": "l1",
      "start": 18.27845805,
      "end": 22.086530612,
      "singer": "s1",
      "role": "lead",
      "words": [
        {
          "text": "La",
          "start": 18.27845805,
          "end": 18.420680272,
          "confidence": null,
          "parts": []
        },
        {
          "text": "terre",
          "start": 18.55600907,
          "end": 18.7138322,
          "confidence": null,
          "parts": []
        },
        {
          "text": "est",
          "start": 18.7138322,
          "end": 18.971428571,
          "confidence": null,
          "parts": []
        },
        {
          "text": "ma",
          "start": 18.971428571,
          "end": 19.557006803,
          "confidence": null,
          "parts": []
        },
        {
          "text": "plus",
          "start": 20.484353741,
          "end": 20.67755102,
          "confidence": null,
          "parts": []
        },
        {
          "text": "jeune",
          "start": 20.741950113,
          "end": 21.03446712,
          "confidence": null,
          "parts": []
        },
        {
          "text": "enfant",
          "start": 21.131972789,
          "end": 22.086530612,
          "confidence": null,
          "parts": []
        }
      ]
    },
    {
      "id": "l2",
      "start": 22.650340136,
      "end": 26.187755102,
      "singer": "s1",
      "role": "lead",
      "words": [
        {
          "text": "Je",
          "start": 22.650340136,
          "end": 22.800544218,
          "confidence": null,
          "parts": []
        },
        {
          "text": "suis",
          "start": 22.8861678,
          "end": 23.140136054,
          "confidence": null,
          "parts": []
        },
        {
          "text": "la",
          "start": 23.140136054,
          "end": 23.341496599,
          "confidence": null,
          "parts": []
        },
        {
          "text": "mère",
          "start": 23.341496599,
          "end": 23.984761905,
          "confidence": null,
          "parts": []
        },
        {
          "text": "de",
          "start": 24.409977324,
          "end": 24.463673469,
          "confidence": null,
          "parts": []
        },
        {
          "text": "tous",
          "start": 24.5569161,
          "end": 24.810884354,
          "confidence": null,
          "parts": []
        },
        {
          "text": "les",
          "start": 24.810884354,
          "end": 24.957823129,
          "confidence": null,
          "parts": []
        },
        {
          "text": "océans",
          "start": 24.957823129,
          "end": 26.187755102,
          "confidence": null,
          "parts": []
        }
      ]
    },
    {
      "id": "l3",
      "start": 27.027664399,
      "end": 30.654693878,
      "singer": "s1",
      "role": "lead",
      "words": [
        {
          "text": "Quand",
          "start": 27.027664399,
          "end": 27.206530612,
          "confidence": null,
          "parts": []
        },
        {
          "text": "je",
          "start": 27.288888889,
          "end": 27.524716553,
          "confidence": null,
          "parts": []
        },
        {
          "text": "m'énerve,",
          "start": 27.524716553,
          "end": 28.325442177,
          "confidence": null,
          "parts": []
        },
        {
          "text": "deux",
          "start": 28.917913832,
          "end": 29.202721088,
          "confidence": null,
          "parts": []
        },
        {
          "text": "ou",
          "start": 29.202721088,
          "end": 29.349659864,
          "confidence": null,
          "parts": []
        },
        {
          "text": "trois",
          "start": 29.349659864,
          "end": 29.636281179,
          "confidence": null,
          "parts": []
        },
        {
          "text": "volcans",
          "start": 29.636281179,
          "end": 30.654693878,
          "confidence": null,
          "parts": []
        }
      ]
    },
    {
      "id": "l4",
      "start": 31.326984127,
      "end": 35.282721088,
      "singer": "s1",
      "role": "lead",
      "words": [
        {
          "text": "Un",
          "start": 31.326984127,
          "end": 31.521088435,
          "confidence": null,
          "parts": []
        },
        {
          "text": "petit",
          "start": 31.655328798,
          "end": 31.923809524,
          "confidence": null,
          "parts": []
        },
        {
          "text": "déluge",
          "start": 31.923809524,
          "end": 32.910204082,
          "confidence": null,
          "parts": []
        },
        {
          "text": "et",
          "start": 33.239002268,
          "end": 33.556462585,
          "confidence": null,
          "parts": []
        },
        {
          "text": "un",
          "start": 33.556462585,
          "end": 33.839455782,
          "confidence": null,
          "parts": []
        },
        {
          "text": "tremblement",
          "start": 33.839455782,
          "end": 35.282721088,
          "confidence": null,
          "parts": []
        }
      ]
    },
    {
      "id": "l5",
      "start": 35.763809524,
      "end": 39.814965986,
      "singer": "s1",
      "role": "lead",
      "words": [
        {
          "text": "Je",
          "start": 35.763809524,
          "end": 35.959727891,
          "confidence": null,
          "parts": []
        },
        {
          "text": "n'peux",
          "start": 35.959727891,
          "end": 36.292789116,
          "confidence": null,
          "parts": []
        },
        {
          "text": "pas",
          "start": 36.292789116,
          "end": 36.593197279,
          "confidence": null,
          "parts": []
        },
        {
          "text": "dire",
          "start": 36.593197279,
          "end": 37.298503401,
          "confidence": null,
          "parts": []
        },
        {
          "text": "que",
          "start": 37.394285714,
          "end": 37.664217687,
          "confidence": null,
          "parts": []
        },
        {
          "text": "la",
          "start": 37.664217687,
          "end": 37.921088435,
          "confidence": null,
          "parts": []
        },
        {
          "text": "vie",
          "start": 37.921088435,
          "end": 38.191020408,
          "confidence": null,
          "parts": []
        },
        {
          "text": "m'est",
          "start": 38.191020408,
          "end": 38.471836735,
          "confidence": null,
          "parts": []
        },
        {
          "text": "dure",
          "start": 38.471836735,
          "end": 39.814965986,
          "confidence": null,
          "parts": []
        }
      ]
    },
    {
      "id": "l6",
      "start": 40.106666667,
      "end": 44.151292517,
      "singer": "s1",
      "role": "lead",
      "words": [
        {
          "text": "J'vais",
          "start": 40.106666667,
          "end": 40.376598639,
          "confidence": null,
          "parts": []
        },
        {
          "text": "pas",
          "start": 40.376598639,
          "end": 40.537687075,
          "confidence": null,
          "parts": []
        },
        {
          "text": "te",
          "start": 40.653061224,
          "end": 40.790204082,
          "confidence": null,
          "parts": []
        },
        {
          "text": "faire",
          "start": 40.938231293,
          "end": 41.467210884,
          "confidence": null,
          "parts": []
        },
        {
          "text": "une",
          "start": 41.467210884,
          "end": 42.020861678,
          "confidence": null,
          "parts": []
        },
        {
          "text": "gueule",
          "start": 42.020861678,
          "end": 42.476190476,
          "confidence": null,
          "parts": []
        },
        {
          "text": "d'atmosphère",
          "start": 42.476190476,
          "end": 44.151292517,
          "confidence": null,
          "parts": []
        }
      ]
    },
    {
      "id": "l7",
      "start": 45.576417234,
      "end": 49.74585034,
      "singer": "s1",
      "role": "lead",
      "words": [
        {
          "text": "Je",
          "start": 45.576417234,
          "end": 45.675102041,
          "confidence": null,
          "parts": []
        },
        {
          "text": "suis",
          "start": 45.815873016,
          "end": 46.146031746,
          "confidence": null,
          "parts": []
        },
        {
          "text": "là,",
          "start": 46.146031746,
          "end": 46.776598639,
          "confidence": null,
          "parts": []
        },
        {
          "text": "je",
          "start": 47.707936508,
          "end": 47.856326531,
          "confidence": null,
          "parts": []
        },
        {
          "text": "suis",
          "start": 47.976417234,
          "end": 48.272108844,
          "confidence": null,
          "parts": []
        },
        {
          "text": "la",
          "start": 48.272108844,
          "end": 48.409251701,
          "confidence": null,
          "parts": []
        },
        {
          "text": "mère",
          "start": 48.560544218,
          "end": 48.948752834,
          "confidence": null,
          "parts": []
        },
        {
          "text": "nature",
          "start": 48.948752834,
          "end": 49.74585034,
          "confidence": null,
          "parts": []
        }
      ]
    },
    {
      "id": "l8",